{
  "schemaVersion": "1.0",
  "sessionId": "opaque-session-id",
  "skill": "spec-protocol",
  "event": "question",
  "questionKey": "BUILD_TARGET",
  "text": "Tell me about your idea in your own words: what is it, and who is it for?",
  "answerKind": "free_text",
  "allowedInputModes": ["voice", "typed", "terminal"],
  "readAloud": true,
  "sensitivity": "normal",
  "counted": false,
  "progress": null,
  "helpText": "A sentence or two is plenty.",
  "canGoBack": true
}
